[
  {
    "id": "quo_0001",
    "quoteNo": "GW-FIRE-20260301-001",
    "divisionId": "fire",
    "customerId": "cus_0005",
    "buildingId": "bld_0009",
    "conditions": {
      "grade": "작동"
    },
    "items": [
      {
        "code": "base",
        "name": "기본 점검료",
        "basis": "연면적 16,063.39㎡ → 10,000~30,000㎡",
        "amount": 1940000
      },
      {
        "code": "usage",
        "name": "용도 보정",
        "basis": "공동주택 → 주거 계수 ×0.9",
        "amount": -194000
      },
      {
        "code": "floors",
        "name": "고층 가산",
        "basis": "지상 12층 중 10층 초과 2개 층 × 25,000원",
        "amount": 50000
      },
      {
        "code": "underground",
        "name": "지하층 가산",
        "basis": "지하 1개 층 × 40,000원",
        "amount": 40000
      }
    ],
    "subtotal": 1836000,
    "vat": 183600,
    "total": 2019600,
    "pricingSource": "store",
    "pricingVersion": null,
    "templateVersionId": null,
    "templateVersion": null,
    "files": null,
    "pdfStatus": null,
    "status": "lost",
    "createdAt": "2026-03-01T01:00:00.000Z"
  },
  {
    "id": "quo_0002",
    "quoteNo": "GW-FIRE-20260305-001",
    "divisionId": "fire",
    "customerId": "cus_0001",
    "buildingId": "bld_0001",
    "conditions": {
      "grade": "종합"
    },
    "items": [
      {
        "code": "base",
        "name": "기본 점검료",
        "basis": "연면적 12,803.25㎡ → 10,000~30,000㎡",
        "amount": 1940000
      },
      {
        "code": "grade",
        "name": "점검 등급 보정",
        "basis": "종합 점검 계수 ×1.6",
        "amount": 1164000
      },
      {
        "code": "floors",
        "name": "고층 가산",
        "basis": "지상 17층 중 10층 초과 7개 층 × 25,000원",
        "amount": 175000
      },
      {
        "code": "underground",
        "name": "지하층 가산",
        "basis": "지하 5개 층 × 40,000원",
        "amount": 200000
      }
    ],
    "subtotal": 3479000,
    "vat": 347900,
    "total": 3826900,
    "pricingSource": "store",
    "pricingVersion": null,
    "templateVersionId": null,
    "templateVersion": null,
    "files": null,
    "pdfStatus": null,
    "status": "won",
    "createdAt": "2026-03-05T01:00:00.000Z"
  },
  {
    "id": "quo_0003",
    "quoteNo": "GW-FIRE-20260307-001",
    "divisionId": "fire",
    "customerId": "cus_0001",
    "buildingId": "bld_0002",
    "conditions": {
      "grade": "작동"
    },
    "items": [
      {
        "code": "base",
        "name": "기본 점검료",
        "basis": "연면적 2,205.41㎡ → 1,000~5,000㎡",
        "amount": 680000
      },
      {
        "code": "usage",
        "name": "용도 보정",
        "basis": "제2종근린생활시설 → 근린 계수 ×1.05",
        "amount": 34000
      },
      {
        "code": "underground",
        "name": "지하층 가산",
        "basis": "지하 1개 층 × 40,000원",
        "amount": 40000
      }
    ],
    "subtotal": 754000,
    "vat": 75400,
    "total": 829400,
    "pricingSource": "store",
    "pricingVersion": null,
    "templateVersionId": null,
    "templateVersion": null,
    "files": null,
    "pdfStatus": null,
    "status": "lost",
    "createdAt": "2026-03-07T01:00:00.000Z"
  },
  {
    "id": "quo_0004",
    "quoteNo": "GW-FIRE-20260309-001",
    "divisionId": "fire",
    "customerId": "cus_0022",
    "buildingId": "bld_0034",
    "conditions": {
      "grade": "작동"
    },
    "items": [
      {
        "code": "base",
        "name": "기본 점검료",
        "basis": "연면적 16,338.71㎡ → 10,000~30,000㎡",
        "amount": 1940000
      },
      {
        "code": "usage",
        "name": "용도 보정",
        "basis": "공동주택 → 주거 계수 ×0.9",
        "amount": -194000
      },
      {
        "code": "floors",
        "name": "고층 가산",
        "basis": "지상 28층 중 10층 초과 18개 층 × 25,000원",
        "amount": 450000
      },
      {
        "code": "underground",
        "name": "지하층 가산",
        "basis": "지하 3개 층 × 40,000원",
        "amount": 120000
      }
    ],
    "subtotal": 2316000,
    "vat": 231600,
    "total": 2547600,
    "pricingSource": "store",
    "pricingVersion": null,
    "templateVersionId": null,
    "templateVersion": null,
    "files": null,
    "pdfStatus": null,
    "status": "lost",
    "createdAt": "2026-03-09T01:00:00.000Z"
  },
  {
    "id": "quo_0005",
    "quoteNo": "GW-FIRE-20260309-002",
    "divisionId": "fire",
    "customerId": "cus_0009",
    "buildingId": "bld_0017",
    "conditions": {
      "grade": "종합"
    },
    "items": [
      {
        "code": "base",
        "name": "기본 점검료",
        "basis": "연면적 20,496.57㎡ → 10,000~30,000㎡",
        "amount": 1940000
      },
      {
        "code": "grade",
        "name": "점검 등급 보정",
        "basis": "종합 점검 계수 ×1.6",
        "amount": 1164000
      },
      {
        "code": "floors",
        "name": "고층 가산",
        "basis": "지상 14층 중 10층 초과 4개 층 × 25,000원",
        "amount": 100000
      },
      {
        "code": "underground",
        "name": "지하층 가산",
        "basis": "지하 4개 층 × 40,000원",
        "amount": 160000
      }
    ],
    "subtotal": 3364000,
    "vat": 336400,
    "total": 3700400,
    "pricingSource": "store",
    "pricingVersion": null,
    "templateVersionId": null,
    "templateVersion": null,
    "files": null,
    "pdfStatus": null,
    "status": "lost",
    "createdAt": "2026-03-09T01:00:00.000Z"
  },
  {
    "id": "quo_0006",
    "quoteNo": "GW-FIRE-20260310-001",
    "divisionId": "fire",
    "customerId": "cus_0017",
    "buildingId": "bld_0029",
    "conditions": {
      "grade": "작동"
    },
    "items": [
      {
        "code": "base",
        "name": "기본 점검료",
        "basis": "연면적 11,607.86㎡ → 10,000~30,000㎡",
        "amount": 1940000
      },
      {
        "code": "usage",
        "name": "용도 보정",
        "basis": "판매시설 → 판매 계수 ×1.2",
        "amount": 388000
      },
      {
        "code": "underground",
        "name": "지하층 가산",
        "basis": "지하 4개 층 × 40,000원",
        "amount": 160000
      }
    ],
    "subtotal": 2488000,
    "vat": 248800,
    "total": 2736800,
    "pricingSource": "store",
    "pricingVersion": null,
    "templateVersionId": null,
    "templateVersion": null,
    "files": null,
    "pdfStatus": null,
    "status": "won",
    "createdAt": "2026-03-10T01:00:00.000Z"
  },
  {
    "id": "quo_0007",
    "quoteNo": "GW-FIRE-20260311-001",
    "divisionId": "fire",
    "customerId": "cus_0002",
    "buildingId": "bld_0003",
    "conditions": {
      "grade": "종합"
    },
    "items": [
      {
        "code": "base",
        "name": "기본 점검료",
        "basis": "연면적 2,842.91㎡ → 1,000~5,000㎡",
        "amount": 680000
      },
      {
        "code": "grade",
        "name": "점검 등급 보정",
        "basis": "종합 점검 계수 ×1.6",
        "amount": 408000
      }
    ],
    "subtotal": 1088000,
    "vat": 108800,
    "total": 1196800,
    "pricingSource": "store",
    "pricingVersion": null,
    "templateVersionId": null,
    "templateVersion": null,
    "files": null,
    "pdfStatus": null,
    "status": "won",
    "createdAt": "2026-03-11T01:00:00.000Z"
  },
  {
    "id": "quo_0008",
    "quoteNo": "GW-FIRE-20260321-001",
    "divisionId": "fire",
    "customerId": "cus_0011",
    "buildingId": "bld_0021",
    "conditions": {
      "grade": "작동"
    },
    "items": [
      {
        "code": "base",
        "name": "기본 점검료",
        "basis": "연면적 8,589.96㎡ → 5,000~10,000㎡",
        "amount": 1150000
      },
      {
        "code": "usage",
        "name": "용도 보정",
        "basis": "공장 → 공장 계수 ×1.3",
        "amount": 345000
      }
    ],
    "subtotal": 1495000,
    "vat": 149500,
    "total": 1644500,
    "pricingSource": "store",
    "pricingVersion": null,
    "templateVersionId": null,
    "templateVersion": null,
    "files": null,
    "pdfStatus": null,
    "status": "won",
    "createdAt": "2026-03-21T01:00:00.000Z"
  },
  {
    "id": "quo_0009",
    "quoteNo": "GW-FIRE-20260401-001",
    "divisionId": "fire",
    "customerId": "cus_0006",
    "buildingId": "bld_0012",
    "conditions": {
      "grade": "작동"
    },
    "items": [
      {
        "code": "base",
        "name": "기본 점검료",
        "basis": "연면적 3,109.93㎡ → 1,000~5,000㎡",
        "amount": 680000
      },
      {
        "code": "usage",
        "name": "용도 보정",
        "basis": "판매시설 → 판매 계수 ×1.2",
        "amount": 136000
      },
      {
        "code": "underground",
        "name": "지하층 가산",
        "basis": "지하 2개 층 × 40,000원",
        "amount": 80000
      }
    ],
    "subtotal": 896000,
    "vat": 89600,
    "total": 985600,
    "pricingSource": "store",
    "pricingVersion": null,
    "templateVersionId": null,
    "templateVersion": null,
    "files": null,
    "pdfStatus": null,
    "status": "sent",
    "createdAt": "2026-04-01T01:00:00.000Z"
  },
  {
    "id": "quo_0010",
    "quoteNo": "GW-FIRE-20260402-001",
    "divisionId": "fire",
    "customerId": "cus_0009",
    "buildingId": "bld_0018",
    "conditions": {
      "grade": "종합"
    },
    "items": [
      {
        "code": "base",
        "name": "기본 점검료",
        "basis": "연면적 10,988.64㎡ → 10,000~30,000㎡",
        "amount": 1940000
      },
      {
        "code": "grade",
        "name": "점검 등급 보정",
        "basis": "종합 점검 계수 ×1.6",
        "amount": 1164000
      },
      {
        "code": "underground",
        "name": "지하층 가산",
        "basis": "지하 1개 층 × 40,000원",
        "amount": 40000
      }
    ],
    "subtotal": 3144000,
    "vat": 314400,
    "total": 3458400,
    "pricingSource": "store",
    "pricingVersion": null,
    "templateVersionId": null,
    "templateVersion": null,
    "files": null,
    "pdfStatus": null,
    "status": "lost",
    "createdAt": "2026-04-02T01:00:00.000Z"
  },
  {
    "id": "quo_0011",
    "quoteNo": "GW-FIRE-20260413-001",
    "divisionId": "fire",
    "customerId": "cus_0006",
    "buildingId": "bld_0011",
    "conditions": {
      "grade": "작동"
    },
    "items": [
      {
        "code": "base",
        "name": "기본 점검료",
        "basis": "연면적 27,083.07㎡ → 10,000~30,000㎡",
        "amount": 1940000
      },
      {
        "code": "usage",
        "name": "용도 보정",